{
  "interlockings": {
    "Christopher": {
      "codeline": "AAR Tokens",
      "devices": [
        {
          "bindings": [
            {
              "function": "LAMP",
              "route": "Christopher/0x23/A2"
            }
          ],
          "serves": "Christopher:MC1",
          "type": {
            "appliance": "lamp"
          }
        },
        {
          "bindings": [
            {
              "function": "LAMP",
              "route": "Christopher/0x23/A3"
            }
          ],
          "serves": "Christopher:MC2",
          "type": {
            "appliance": "lamp"
          }
        },
        {
          "bindings": [
            {
              "function": "M",
              "route": "Christopher/0x21/A5"
            },
            {
              "function": "N",
              "route": "Christopher/0x21/A6"
            },
            {
              "function": "OCC",
              "route": "Christopher/0x21/A8"
            },
            {
              "function": "R",
              "route": "Christopher/0x21/A7"
            }
          ],
          "serves": "Christopher:813",
          "type": {
            "appliance": "switch",
            "style": [
              "dual",
              "lock",
              "powered"
            ]
          }
        },
        {
          "bindings": [
            {
              "function": "M",
              "route": "Christopher/0x21/B1"
            },
            {
              "function": "N",
              "route": "Christopher/0x21/B2"
            },
            {
              "function": "OCC",
              "route": "Christopher/0x21/B4"
            },
            {
              "function": "R",
              "route": "Christopher/0x21/B3"
            }
          ],
          "serves": "Christopher:815",
          "type": {
            "appliance": "switch",
            "style": [
              "powered"
            ]
          }
        },
        {
          "bindings": [
            {
              "function": "M",
              "route": "Christopher/0x22/A5"
            },
            {
              "function": "N",
              "route": "Christopher/0x22/A6"
            },
            {
              "function": "OCC",
              "route": "Christopher/0x22/A8"
            },
            {
              "function": "R",
              "route": "Christopher/0x22/A7"
            }
          ],
          "serves": "Christopher:817",
          "type": {
            "appliance": "switch",
            "style": [
              "dual",
              "lock",
              "powered"
            ]
          }
        },
        {
          "bindings": [
            {
              "function": "M",
              "route": "Christopher/0x22/B1"
            },
            {
              "function": "N",
              "route": "Christopher/0x22/B2"
            },
            {
              "function": "OCC",
              "route": "Christopher/0x22/B4"
            },
            {
              "function": "R",
              "route": "Christopher/0x22/B3"
            }
          ],
          "serves": "Christopher:815A",
          "type": {
            "appliance": "switch",
            "style": [
              "powered"
            ]
          }
        },
        {
          "bindings": [
            {
              "function": "NWK",
              "route": "Christopher/0x21/A1"
            },
            {
              "function": "NWS",
              "route": "Christopher/0x21/A4"
            },
            {
              "function": "RWK",
              "route": "Christopher/0x21/A2"
            },
            {
              "function": "RWS",
              "route": "Christopher/0x21/A3"
            }
          ],
          "serves": "Christopher:813",
          "type": {
            "appliance": "lever",
            "style": [
              "switch"
            ]
          }
        },
        {
          "bindings": [
            {
              "function": "NWK",
              "route": "Christopher/0x22/A1"
            },
            {
              "function": "NWS",
              "route": "Christopher/0x22/A4"
            },
            {
              "function": "RWK",
              "route": "Christopher/0x22/A2"
            },
            {
              "function": "RWS",
              "route": "Christopher/0x22/A3"
            }
          ],
          "serves": "Christopher:817",
          "type": {
            "appliance": "lever",
            "style": [
              "switch"
            ]
          }
        },
        {
          "bindings": [
            {
              "function": "OCC",
              "route": "Christopher/0x22/B5"
            }
          ],
          "serves": "Christopher:01T",
          "settings": {
            "hold_ms": "1500"
          },
          "type": {
            "appliance": "track_circuit"
          }
        },
        {
          "bindings": [
            {
              "function": "OCC",
              "route": "Christopher/0x22/B6"
            }
          ],
          "serves": "Christopher:1NAT",
          "settings": {
            "hold_ms": "1500"
          },
          "type": {
            "appliance": "track_circuit"
          }
        },
        {
          "bindings": [
            {
              "function": "OCC",
              "route": "Christopher/0x22/B7"
            }
          ],
          "serves": "Christopher:1SAT",
          "settings": {
            "hold_ms": "1500"
          },
          "type": {
            "appliance": "track_circuit"
          }
        },
        {
          "bindings": [
            {
              "function": "OCC",
              "route": "Christopher/0x22/B8"
            }
          ],
          "serves": "Christopher:2NAT",
          "settings": {
            "hold_ms": "1500"
          },
          "type": {
            "appliance": "track_circuit"
          }
        },
        {
          "bindings": [
            {
              "function": "OCC",
              "route": "Christopher/0x23/A1"
            }
          ],
          "serves": "Christopher:2SAT",
          "settings": {
            "hold_ms": "1500"
          },
          "type": {
            "appliance": "track_circuit"
          }
        },
        {
          "bindings": [
            {
              "function": "S0",
              "route": "Christopher/0x20/A1"
            },
            {
              "function": "S1",
              "route": "Christopher/0x20/A2"
            }
          ],
          "head": "A",
          "serves": "Christopher:816NAB",
          "type": {
            "appliance": "head",
            "style": [
              "CPL"
            ]
          }
        },
        {
          "bindings": [
            {
              "function": "S0",
              "route": "Christopher/0x20/A3"
            },
            {
              "function": "S1",
              "route": "Christopher/0x20/A4"
            }
          ],
          "head": "B",
          "serves": "Christopher:816NAB",
          "type": {
            "appliance": "head",
            "style": [
              "CPL"
            ]
          }
        },
        {
          "bindings": [
            {
              "function": "S0",
              "route": "Christopher/0x20/A5"
            },
            {
              "function": "S1",
              "route": "Christopher/0x20/A6"
            }
          ],
          "head": "C",
          "serves": "Christopher:816NC",
          "type": {
            "appliance": "head",
            "style": [
              "CPL"
            ]
          }
        },
        {
          "bindings": [
            {
              "function": "S0",
              "route": "Christopher/0x20/A7"
            },
            {
              "function": "S1",
              "route": "Christopher/0x20/A8"
            }
          ],
          "head": "A",
          "serves": "Christopher:816SAB",
          "type": {
            "appliance": "head",
            "style": [
              "CPL"
            ]
          }
        },
        {
          "bindings": [
            {
              "function": "S0",
              "route": "Christopher/0x20/B1"
            },
            {
              "function": "S1",
              "route": "Christopher/0x20/B2"
            }
          ],
          "head": "B",
          "serves": "Christopher:816SAB",
          "type": {
            "appliance": "head",
            "style": [
              "CPL"
            ]
          }
        },
        {
          "bindings": [
            {
              "function": "S0",
              "route": "Christopher/0x20/B3"
            },
            {
              "function": "S1",
              "route": "Christopher/0x20/B4"
            }
          ],
          "head": "C",
          "serves": "Christopher:816SC",
          "type": {
            "appliance": "head",
            "style": [
              "CPL"
            ]
          }
        },
        {
          "bindings": [
            {
              "function": "WLK",
              "invert": true,
              "route": "Christopher/0x20/B5"
            },
            {
              "function": "WLQ",
              "route": "Christopher/0x20/B7"
            },
            {
              "function": "WLQK",
              "route": "Christopher/0x20/B6"
            }
          ],
          "serves": "Christopher:813",
          "type": {
            "appliance": "lever",
            "style": [
              "lock"
            ]
          }
        },
        {
          "bindings": [
            {
              "function": "WLK",
              "invert": true,
              "route": "Christopher/0x21/B5"
            },
            {
              "function": "WLQ",
              "route": "Christopher/0x21/B7"
            },
            {
              "function": "WLQK",
              "route": "Christopher/0x21/B6"